{
  "lib": "LLM_Layout_Design_Lab",
  "cell": "IO_RING_12x12",
  "vdd_value": 1.8,
  "llm_model": "Claude Opus 4.7",
  "timestamp": "2026-05-01T11:55:00Z",
  "pins": [
    {
      "name": "VREFDES",
      "pin_type": "reference",
      "confidence": 0.95,
      "reason": "VREF prefix = voltage reference for design; not a power supply pin"
    },
    {
      "name": "VDD_CDAC",
      "pin_type": "power",
      "confidence": 0.98,
      "reason": "VDD prefix = supply voltage for CDAC block"
    },
    {
      "name": "IB12",
      "pin_type": "analog_input",
      "confidence": 0.85,
      "reason": "IB prefix = bias current input; analog bias signal"
    },
    {
      "name": "VDD12",
      "pin_type": "power",
      "confidence": 0.98,
      "reason": "VDD prefix = supply voltage for block 12"
    },
    {
      "name": "IB3",
      "pin_type": "analog_input",
      "confidence": 0.85,
      "reason": "IB prefix = bias current input; analog bias signal"
    },
    {
      "name": "VDD3",
      "pin_type": "power",
      "confidence": 0.98,
      "reason": "VDD prefix = supply voltage for block 3"
    },
    {
      "name": "GIOL",
      "pin_type": "digital_bidirectional",
      "confidence": 0.80,
      "reason": "GIO = GPIO pad pin (general-purpose IO); bidirectional digital interface; L = low voltage domain"
    },
    {
      "name": "VIOL",
      "pin_type": "power",
      "confidence": 0.90,
      "reason": "VIO prefix = IO supply voltage; L = low domain; supply pin not signal"
    },
    {
      "name": "GIOH",
      "pin_type": "digital_bidirectional",
      "confidence": 0.80,
      "reason": "GIO = GPIO pad pin (general-purpose IO); bidirectional digital interface; H = high voltage domain"
    },
    {
      "name": "VIOH",
      "pin_type": "power",
      "confidence": 0.90,
      "reason": "VIO prefix = IO supply voltage; H = high domain; supply pin not signal"
    },
    {
      "name": "SYNC",
      "pin_type": "digital_bidirectional",
      "confidence": 0.70,
      "reason": "SYNC = synchronization signal; typically bidirectional in IO ring; direction=inputOutput"
    },
    {
      "name": "SYNC_CORE",
      "pin_type": "digital_bidirectional",
      "confidence": 0.70,
      "reason": "Core-side SYNC signal; matches SYNC classification"
    },
    {
      "name": "DCLK",
      "pin_type": "clock",
      "confidence": 0.95,
      "reason": "CLK suffix = clock signal; D prefix = data clock"
    },
    {
      "name": "DCLK_CORE",
      "pin_type": "clock",
      "confidence": 0.95,
      "reason": "Core-side DCLK signal; matches DCLK classification"
    },
    {
      "name": "CLKP",
      "pin_type": "clock",
      "confidence": 0.95,
      "reason": "CLK prefix = clock signal; P = positive differential"
    },
    {
      "name": "CLKN",
      "pin_type": "clock",
      "confidence": 0.95,
      "reason": "CLK prefix = clock signal; N = negative differential"
    },
    {
      "name": "GND_DAT_CORE",
      "pin_type": "ground",
      "confidence": 0.98,
      "reason": "GND prefix = ground for DAT block core side"
    },
    {
      "name": "GND_DAT",
      "pin_type": "ground",
      "confidence": 0.98,
      "reason": "GND prefix = ground for DAT block"
    },
    {
      "name": "VDD_DAT_CORE",
      "pin_type": "power",
      "confidence": 0.98,
      "reason": "VDD prefix = supply voltage for DAT block core side"
    },
    {
      "name": "VDD_DAT",
      "pin_type": "power",
      "confidence": 0.98,
      "reason": "VDD prefix = supply voltage for DAT block"
    },
    {
      "name": "VCM",
      "pin_type": "reference",
      "confidence": 0.90,
      "reason": "VCM = common-mode voltage reference for analog inputs"
    },
    {
      "name": "VSSCLK",
      "pin_type": "ground",
      "confidence": 0.98,
      "reason": "VSS prefix = ground for CLK block"
    },
    {
      "name": "VDDCLK",
      "pin_type": "power",
      "confidence": 0.98,
      "reason": "VDD prefix = supply voltage for CLK block"
    },
    {
      "name": "VDDSAR",
      "pin_type": "power",
      "confidence": 0.98,
      "reason": "VDD prefix = supply voltage for SAR ADC block"
    },
    {
      "name": "VSSSAR",
      "pin_type": "ground",
      "confidence": 0.98,
      "reason": "VSS prefix = ground for SAR ADC block"
    },
    {
      "name": "VREFH_CORE",
      "pin_type": "reference",
      "confidence": 0.95,
      "reason": "VREF prefix = voltage reference; H = high reference; core side"
    },
    {
      "name": "VREFH",
      "pin_type": "reference",
      "confidence": 0.95,
      "reason": "VREF prefix = voltage reference; H = high reference"
    },
    {
      "name": "VREFM",
      "pin_type": "reference",
      "confidence": 0.95,
      "reason": "VREF prefix = voltage reference; M = mid reference"
    },
    {
      "name": "VREFN_CORE",
      "pin_type": "reference",
      "confidence": 0.95,
      "reason": "VREF prefix = voltage reference; N = negative/low reference; core side"
    },
    {
      "name": "VREFN",
      "pin_type": "reference",
      "confidence": 0.95,
      "reason": "VREF prefix = voltage reference; N = negative/low reference"
    },
    {
      "name": "D4",
      "pin_type": "digital_bidirectional",
      "confidence": 0.80,
      "reason": "D prefix = data pin; bidirectional in IO ring; direction=inputOutput"
    },
    {
      "name": "D4_CORE",
      "pin_type": "digital_bidirectional",
      "confidence": 0.80,
      "reason": "Core-side D4 signal; matches D4 classification"
    },
    {
      "name": "D3",
      "pin_type": "digital_bidirectional",
      "confidence": 0.80,
      "reason": "D prefix = data pin; bidirectional in IO ring; direction=inputOutput"
    },
    {
      "name": "D3_CORE",
      "pin_type": "digital_bidirectional",
      "confidence": 0.80,
      "reason": "Core-side D3 signal; matches D3 classification"
    },
    {
      "name": "D2",
      "pin_type": "digital_bidirectional",
      "confidence": 0.80,
      "reason": "D prefix = data pin; bidirectional in IO ring; direction=inputOutput"
    },
    {
      "name": "D2_CORE",
      "pin_type": "digital_bidirectional",
      "confidence": 0.80,
      "reason": "Core-side D2 signal; matches D2 classification"
    },
    {
      "name": "D1",
      "pin_type": "digital_bidirectional",
      "confidence": 0.80,
      "reason": "D prefix = data pin; bidirectional in IO ring; direction=inputOutput"
    },
    {
      "name": "D1_CORE",
      "pin_type": "digital_bidirectional",
      "confidence": 0.80,
      "reason": "Core-side D1 signal; matches D1 classification"
    },
    {
      "name": "D0",
      "pin_type": "digital_bidirectional",
      "confidence": 0.80,
      "reason": "D prefix = data pin; bidirectional in IO ring; direction=inputOutput"
    },
    {
      "name": "D0_CORE",
      "pin_type": "digital_bidirectional",
      "confidence": 0.80,
      "reason": "Core-side D0 signal; matches D0 classification"
    },
    {
      "name": "RST",
      "pin_type": "reset",
      "confidence": 0.98,
      "reason": "RST = reset signal; active control pin"
    },
    {
      "name": "RST_CORE",
      "pin_type": "reset",
      "confidence": 0.98,
      "reason": "Core-side RST signal; matches RST classification"
    },
    {
      "name": "SDO",
      "pin_type": "digital_output",
      "confidence": 0.95,
      "reason": "SDO = serial data out; digital output from ADC"
    },
    {
      "name": "SDO_CORE",
      "pin_type": "digital_output",
      "confidence": 0.95,
      "reason": "Core-side SDO signal; matches SDO classification"
    },
    {
      "name": "SCK",
      "pin_type": "clock",
      "confidence": 0.95,
      "reason": "SCK = serial clock; SPI clock signal"
    },
    {
      "name": "SCK_CORE",
      "pin_type": "clock",
      "confidence": 0.95,
      "reason": "Core-side SCK signal; matches SCK classification"
    },
    {
      "name": "SDI",
      "pin_type": "digital_input",
      "confidence": 0.95,
      "reason": "SDI = serial data in; digital input for SPI configuration"
    },
    {
      "name": "SDI_CORE",
      "pin_type": "digital_input",
      "confidence": 0.95,
      "reason": "Core-side SDI signal; matches SDI classification"
    },
    {
      "name": "SLP",
      "pin_type": "digital_input",
      "confidence": 0.90,
      "reason": "SLP = sleep/power-down control; digital input control signal"
    },
    {
      "name": "SLP_CORE",
      "pin_type": "digital_input",
      "confidence": 0.90,
      "reason": "Core-side SLP signal; matches SLP classification"
    },
    {
      "name": "VREFDES2",
      "pin_type": "reference",
      "confidence": 0.95,
      "reason": "VREF prefix = voltage reference; second design reference"
    },
    {
      "name": "IBREF2",
      "pin_type": "analog_input",
      "confidence": 0.85,
      "reason": "IB prefix = bias current; REF = reference; analog bias current input"
    },
    {
      "name": "IBREF",
      "pin_type": "analog_input",
      "confidence": 0.85,
      "reason": "IB prefix = bias current; REF = reference; analog bias current input"
    },
    {
      "name": "VSS",
      "pin_type": "ground",
      "confidence": 0.98,
      "reason": "VSS = ground supply"
    },
    {
      "name": "IBUF_IBIAS",
      "pin_type": "analog_input",
      "confidence": 0.85,
      "reason": "IB prefix = bias current; input buffer bias current; analog input"
    },
    {
      "name": "VDDIB_CORE",
      "pin_type": "power",
      "confidence": 0.98,
      "reason": "VDD prefix = supply voltage for IB block core side"
    },
    {
      "name": "VDDIB",
      "pin_type": "power",
      "confidence": 0.98,
      "reason": "VDD prefix = supply voltage for IB block"
    },
    {
      "name": "VSSIB",
      "pin_type": "ground",
      "confidence": 0.98,
      "reason": "VSS prefix = ground for IB block"
    },
    {
      "name": "VINN",
      "pin_type": "analog_input",
      "confidence": 0.95,